{
  "schema_version": 1,
  "benchmark_id": "oireachtas-query-service-phase-2-realistic",
  "benchmark_version": "1.0.0",
  "dataset_evidence": {
    "path": "poc/nlq/benchmarks/development-data-evidence.md",
    "dataset_id": "sha256:9da63abc5878387f991e4d4717f35cca67606850db34be589e0a8fc0cc1504e2",
    "status": "non-authoritative-development-bootstrap"
  },
  "cases": [
    {"id":"member.aengus-name","question":"Find Aengus Ó Snodaigh's full name for me.","category":"simple_lookup","tiers":["measured"],"support_expectation":"supported","expected_interpretation":"Resolve Aengus Ó Snodaigh as one Member and return the full name.","expected_result":{"kind":"select","invariants":{"min_rows":1,"contains_values":["Aengus Ó Snodaigh"]}},"evaluation_mode":"semantic_invariants","dataset_prerequisites":{"required_graph_families":["members"],"required_resources":[],"coverage_probes":[],"unavailable_if":null}},
    {"id":"member.aengus-dail33","question":"Did Aengus Ó Snodaigh serve in the 33rd Dáil?","category":"house_term_membership","tiers":["measured"],"support_expectation":"supported","expected_interpretation":"Check whether the named Member has membership in the named Dáil term.","expected_result":{"kind":"ask","boolean":true},"evaluation_mode":"semantic_invariants","dataset_prerequisites":{"required_graph_families":["members","houses"],"required_resources":[],"coverage_probes":[],"unavailable_if":null}},
    {"id":"member.micheal-terms","question":"Which Dáil terms did Micheál Martin sit in?","category":"house_term_membership","tiers":["measured"],"support_expectation":"supported","expected_interpretation":"List the Dáil terms linked to Micheál Martin's Member record.","expected_result":{"kind":"select","invariants":{"min_rows":9,"contains_values":["26th Dáil","27th Dáil","28th Dáil","29th Dáil","30th Dáil","31st Dáil","32nd Dáil","33rd Dáil","34th Dáil"]}},"evaluation_mode":"semantic_invariants","dataset_prerequisites":{"required_graph_families":["members","houses"],"required_resources":[],"coverage_probes":[],"unavailable_if":null}},
    {"id":"member.count-micheal-terms","question":"How many Dáil terms has Micheál Martin served in?","category":"counts_aggregates","tiers":["measured"],"support_expectation":"supported","expected_interpretation":"Count the Dáil terms linked to Micheál Martin.","expected_result":{"kind":"select","invariants":{"row_count":1,"integer_scalar":true}},"evaluation_mode":"semantic_invariants","dataset_prerequisites":{"required_graph_families":["members","houses"],"required_resources":[],"coverage_probes":[],"unavailable_if":null}},
    {"id":"member.timmy-seanad-start","question":"When did Timmy Dooley join the 26th Seanad?","category":"dates_temporal","tiers":["measured"],"support_expectation":"supported","expected_interpretation":"Return the recorded start date of Timmy Dooley's 26th Seanad membership.","expected_result":{"kind":"select","invariants":{"min_rows":1,"contains_text":["2020-06-29"]}},"evaluation_mode":"semantic_invariants","dataset_prerequisites":{"required_graph_families":["members","houses"],"required_resources":[],"coverage_probes":[],"unavailable_if":null}},
    {"id":"collection.aengus-sf","question":"Which party was Aengus Ó Snodaigh part of while serving in the 33rd Dáil?","category":"parliamentary_collections","tiers":["measured"],"support_expectation":"supported","expected_interpretation":"Find Aengus Ó Snodaigh's parliamentary collection membership scoped to the 33rd Dáil.","expected_result":{"kind":"select","invariants":{"min_rows":1,"contains_values":["Sinn Féin"]}},"evaluation_mode":"semantic_invariants","dataset_prerequisites":{"required_graph_families":["members","houses","parties"],"required_resources":[],"coverage_probes":[],"unavailable_if":null}},
    {"id":"collection.timmy-ff","question":"Which party did Timmy Dooley belong to in the 26th Seanad?","category":"parliamentary_collections","tiers":["measured"],"support_expectation":"supported","expected_interpretation":"Find Timmy Dooley's parliamentary collection membership scoped to the 26th Seanad.","expected_result":{"kind":"select","invariants":{"min_rows":1,"contains_values":["Fianna Fáil"]}},"evaluation_mode":"semantic_invariants","dataset_prerequisites":{"required_graph_families":["members","houses","parties"],"required_resources":[],"coverage_probes":[],"unavailable_if":null}},
    {"id":"collection.lowry-independent","question":"Which collection included Michael Lowry in the 33rd Dáil?","category":"parliamentary_collections","tiers":["measured"],"support_expectation":"supported","expected_interpretation":"Find Michael Lowry's collection membership in the 33rd Dáil, including an Independent collection if recorded.","expected_result":{"kind":"select","invariants":{"min_rows":1,"contains_values":["Independent"]}},"evaluation_mode":"semantic_invariants","dataset_prerequisites":{"required_graph_families":["members","houses","parties"],"required_resources":[],"coverage_probes":[],"unavailable_if":null}},
    {"id":"representation.aengus-constituency","question":"Who was the TD for Dublin South-Central in the 33rd Dáil?","category":"constituencies_panels","tiers":["measured"],"support_expectation":"supported","expected_interpretation":"Resolve the constituency and term, then return its Member representative.","expected_result":{"kind":"select","invariants":{"min_rows":1,"contains_values":["Aengus Ó Snodaigh"]}},"evaluation_mode":"semantic_invariants","dataset_prerequisites":{"required_graph_families":["members","houses","constituencies"],"required_resources":[],"coverage_probes":[],"unavailable_if":null}},
    {"id":"representation.timmy-panel","question":"Which panel did Timmy Dooley represent in the 26th Seanad?","category":"constituencies_panels","tiers":["measured"],"support_expectation":"supported","expected_interpretation":"Return Timmy Dooley's Seanad panel representation in the 26th Seanad.","expected_result":{"kind":"select","invariants":{"min_rows":1,"contains_values":["Nominated by the Taoiseach"]}},"evaluation_mode":"semantic_invariants","dataset_prerequisites":{"required_graph_families":["members","houses","constituencies"],"required_resources":[],"coverage_probes":[],"unavailable_if":null}},
    {"id":"committee.timmy-transport","question":"Was Timmy Dooley a member of the Select Committee on Transport and Communications?","category":"committees","tiers":["measured"],"support_expectation":"supported","expected_interpretation":"Check the named Member's asserted membership in the named Committee.","expected_result":{"kind":"ask","boolean":true},"evaluation_mode":"semantic_invariants","dataset_prerequisites":{"required_graph_families":["members","committees"],"required_resources":[],"coverage_probes":[],"unavailable_if":null}},
    {"id":"committee.transport-code","question":"What short code is used for the Joint Committee on Transport and Communications?","category":"committees","tiers":["measured"],"support_expectation":"supported","expected_interpretation":"Resolve the Committee by label and return its recorded code.","expected_result":{"kind":"select","invariants":{"min_rows":1,"contains_values":["TRJ"]}},"evaluation_mode":"semantic_invariants","dataset_prerequisites":{"required_graph_families":["committees"],"required_resources":[],"coverage_probes":[],"unavailable_if":null}},
    {"id":"committee.count-timmy","question":"How many Committee membership records does Timmy Dooley have?","category":"counts_aggregates","tiers":["measured"],"support_expectation":"supported","expected_interpretation":"Count Committee membership relations for Timmy Dooley.","expected_result":{"kind":"select","invariants":{"row_count":1,"integer_scalar":true}},"evaluation_mode":"semantic_invariants","dataset_prerequisites":{"required_graph_families":["members","committees"],"required_resources":[],"coverage_probes":[],"unavailable_if":null}},
    {"id":"committee.goodfriday-quarantined","question":"What is the code for the Select Committee on the Implementation of the Good Friday Agreement?","category":"committees","tiers":["measured"],"support_expectation":"unavailable","expected_interpretation":"This Committee identity is quarantined from the local development dataset and must be reported as source coverage, not an NLQ failure.","expected_result":null,"evaluation_mode":"manual_review","dataset_prerequisites":{"required_graph_families":["committees"],"required_resources":[{"iri":"https://data.oireachtas.ie/ie/oireachtas/committee/dail/33/select_committee_on_the_implementation_of_the_good_friday_agreement","graph_family":"committees"}],"coverage_probes":[],"unavailable_if":{"kind":"quarantined_resource","iri":"https://data.oireachtas.ie/ie/oireachtas/committee/dail/33/select_committee_on_the_implementation_of_the_good_friday_agreement"}}},
    {"id":"aggregate.dail-term-count","question":"How many Dáil terms are listed in the Houses data?","category":"counts_aggregates","tiers":["measured"],"support_expectation":"supported","expected_interpretation":"Count distinct Dáil term resources.","expected_result":{"kind":"select","invariants":{"row_count":1,"integer_scalar":true}},"evaluation_mode":"semantic_invariants","dataset_prerequisites":{"required_graph_families":["houses"],"required_resources":[],"coverage_probes":[],"unavailable_if":null}},
    {"id":"aggregate.dail33-member-count","question":"How many distinct Members served during the 33rd Dáil?","category":"counts_aggregates","tiers":["measured"],"support_expectation":"supported","expected_interpretation":"Count distinct Member resources with membership in the 33rd Dáil.","expected_result":{"kind":"select","invariants":{"row_count":1,"integer_scalar":true}},"evaluation_mode":"semantic_invariants","dataset_prerequisites":{"required_graph_families":["members","houses"],"required_resources":[],"coverage_probes":[],"unavailable_if":null}},